{
  "schema_version": 1,
  "report_kind": "text_route_comparison",
  "workload_sha256": "11c4b26006a3e15ca8ede1950648a1bb5ebf835ef1b2e7519be7da6cc5dc2d09",
  "identity_fields_matched": true,
  "artifact_identity_verified": true,
  "quality_comparable": true,
  "first_route": "direct",
  "minimum_requests_per_route": 30,
  "sample_gate_passed": true,
  "p99_reference_only": true,
  "direct": {
    "report_sha256": "6f6b3ffbf0a38a55afa5b5e4c4b43fada0d2bc782a9be239216e3a3c1c29ac70",
    "route": "mlx_lm_direct",
    "started_at": "2026-09-28T03:10:22.829950+00:00",
    "artifact_identity_verified": true,
    "artifact_identity_sha256": "4f69654cb373cc4392fd048acf60d51d39d67e8176648a3e52a7936b0776cd14",
    "backend_build_sha256": "fbe49ebc3429bb6e5f3ffacaed9ba735f1101d01cd5068724ef9fc0fe174e643",
    "requests": 30,
    "completed": 30,
    "failed": 0,
    "quality_passed": 30,
    "slo_quality_passed": 30,
    "errors": {},
    "elapsed_seconds": 6.920745167,
    "output_tokens_per_second": 17.33917332662279,
    "goodput_tokens_per_second": 17.33917332662279,
    "e2e_p99_upper_bound_ms": 500.0,
    "e2e_p99_reference_only": true
  },
  "proxy": {
    "report_sha256": "88f61c87a2b81cb3f26854b59cf75c2e9a05d40e81e5f11fd5f7dedc2370b18a",
    "route": "mlx_lm_daemon",
    "started_at": "2026-09-28T03:11:04.207636+00:00",
    "artifact_identity_verified": true,
    "artifact_identity_sha256": "4f69654cb373cc4392fd048acf60d51d39d67e8176648a3e52a7936b0776cd14",
    "backend_build_sha256": "fbe49ebc3429bb6e5f3ffacaed9ba735f1101d01cd5068724ef9fc0fe174e643",
    "requests": 30,
    "completed": 30,
    "failed": 0,
    "quality_passed": 30,
    "slo_quality_passed": 30,
    "errors": {},
    "elapsed_seconds": 6.875771833,
    "output_tokens_per_second": 17.452586111724166,
    "goodput_tokens_per_second": 17.452586111724166,
    "e2e_p99_upper_bound_ms": 500.0,
    "e2e_p99_reference_only": true
  },
  "ratios": {
    "proxy_to_direct_goodput": 1.006541,
    "proxy_to_direct_output_throughput": 1.006541,
    "proxy_to_direct_e2e_p99": 1.0
  },
  "conclusion": "comparable",
  "qualification": false
}
