{
  "schema_version": 1,
  "report_kind": "text_route_comparison",
  "workload_sha256": "11c4b26006a3e15ca8ede1950648a1bb5ebf835ef1b2e7519be7da6cc5dc2d09",
  "identity_fields_matched": true,
  "artifact_identity_verified": true,
  "quality_comparable": true,
  "first_route": "proxy",
  "minimum_requests_per_route": 30,
  "sample_gate_passed": true,
  "p99_reference_only": true,
  "direct": {
    "report_sha256": "2015a117f4ae2c487fd849d407990877361a7cda23e3f53be6eb808915b20059",
    "route": "mlx_lm_direct",
    "started_at": "2026-09-28T03:09:51.209125+00:00",
    "artifact_identity_verified": true,
    "artifact_identity_sha256": "4f69654cb373cc4392fd048acf60d51d39d67e8176648a3e52a7936b0776cd14",
    "backend_build_sha256": "fbe49ebc3429bb6e5f3ffacaed9ba735f1101d01cd5068724ef9fc0fe174e643",
    "requests": 30,
    "completed": 30,
    "failed": 0,
    "quality_passed": 30,
    "slo_quality_passed": 30,
    "errors": {},
    "elapsed_seconds": 6.706174917,
    "output_tokens_per_second": 17.893956165056586,
    "goodput_tokens_per_second": 17.893956165056586,
    "e2e_p99_upper_bound_ms": 500.0,
    "e2e_p99_reference_only": true
  },
  "proxy": {
    "report_sha256": "82de804a3e1e3b559c72f2846601723f09b99e13d524a3da3dad00b2620bdd13",
    "route": "mlx_lm_daemon",
    "started_at": "2026-09-28T03:09:18.242176+00:00",
    "artifact_identity_verified": true,
    "artifact_identity_sha256": "4f69654cb373cc4392fd048acf60d51d39d67e8176648a3e52a7936b0776cd14",
    "backend_build_sha256": "fbe49ebc3429bb6e5f3ffacaed9ba735f1101d01cd5068724ef9fc0fe174e643",
    "requests": 30,
    "completed": 30,
    "failed": 0,
    "quality_passed": 30,
    "slo_quality_passed": 30,
    "errors": {},
    "elapsed_seconds": 6.668151209,
    "output_tokens_per_second": 17.99599262806699,
    "goodput_tokens_per_second": 17.99599262806699,
    "e2e_p99_upper_bound_ms": 500.0,
    "e2e_p99_reference_only": true
  },
  "ratios": {
    "proxy_to_direct_goodput": 1.005702,
    "proxy_to_direct_output_throughput": 1.005702,
    "proxy_to_direct_e2e_p99": 1.0
  },
  "conclusion": "comparable",
  "qualification": false
}
